<!-- $Id$ -->

<!ELEMENT metaconfiguration (plugin*, include*, classes*, sources*)>

<!ELEMENT classes (class*)>

<!ELEMENT class (implement*, properties*, pattern)>
<!ATTLIST class
		name		ID #REQUIRED
		type		(final|abstract) #IMPLIED
		extends		CDATA #IMPLIED
		source		CDATA #IMPLIED
		table		CDATA #IMPLIED
>

<!ELEMENT implement EMPTY>
<!ATTLIST implement
		interface	CDATA #REQUIRED
>

<!ELEMENT properties (identifier?, property*)>

<!ELEMENT identifier EMPTY>
<!ATTLIST identifier
		name	CDATA #IMPLIED
		type	CDATA #IMPLIED
		size	CDATA #IMPLIED
		column	CDATA #IMPLIED
>

<!ELEMENT property EMPTY>
<!ATTLIST property
		name		CDATA #REQUIRED
		type		CDATA #REQUIRED
		size		CDATA #IMPLIED
		column		CDATA #IMPLIED
		default		CDATA #IMPLIED
		required	(true|false) "false"
		relation	(OneToOne|OneToMany|ManyToMany) #IMPLIED
		fetch		(lazy|cascade) #IMPLIED
		reference	(true|false) #IMPLIED
		helperTable CDATA #IMPLIED
>

<!ELEMENT pattern EMPTY>
<!ATTLIST pattern
		name		(
			DictionaryClass
			|AbstractClass
			|AbstractValueObject
			|StraightMapping
			|EnumerationClass
			|EnumClass
			|RegistryClass
			|SpookedClass
			|SpookedEnumeration
			|SpookedEnum
			|SpookedRegistry
			|ValueObject
			|InternalClass
			|NosqlClass
			|ObjectWithEmptyDAOClass
		) #REQUIRED
		fetch		(lazy|cascade) #IMPLIED
>

<!ELEMENT sources (source+)>

<!ELEMENT source EMPTY>
<!ATTLIST source
		name	CDATA #REQUIRED
		default	(true|false) "false"
>

<!-- file path is relative to current meta's directory -->
<!ELEMENT include EMPTY>
<!ATTLIST include
		file		CDATA #REQUIRED
		generate	(true|false) "true"
>

<!ELEMENT plugin EMPTY>
<!ATTLIST plugin
		name	CDATA #REQUIRED
		class	CDATA #REQUIRED
>