<?xml version="1.0"?>
<!DOCTYPE metaconfiguration SYSTEM "meta.dtd">

<!-- $Id$ -->

<metaconfiguration><classes>

	<class name="Range">
		<properties>
			<property name="min" type="Integer" required="false" />
			<property name="max" type="Integer" required="false" />
		</properties>
		
		<pattern name="InternalClass" />
	</class>
	
	<class name="DateRange">
		<properties>
			<property name="start" type="Date" required="false" />
			<property name="end" type="Date" required="false" />
		</properties>
		
		<pattern name="InternalClass" />
	</class>
	
	<class name="DateRange">
		<properties>
			<property name="start" type="Timestamp" required="false" />
			<property name="end" type="Timestamp" required="false" />
		</properties>
		
		<pattern name="InternalClass" />
	</class>

</classes></metaconfiguration>